Date,City,Slot,Duration,Activity,Flexible,Type,Notes,Lat,Long
2027-01-01,Helsinki,Morning,4h,Arrival & Check-in,No,Travel,Check into Hotel St. George.,60.1686,24.9384
2027-01-01,Helsinki,Afternoon,3h,Design District,Yes,Activity,Explore 19th-century architecture.,60.1631,24.9410
2027-01-01,Helsinki,Night,2h,Löyly Sauna,Yes,Relax,Traditional Finnish sauna by the sea.,60.1500,24.9281
2027-01-03,Krakow,Morning,8h,Auschwitz-Birkenau,No,History,Booked tour. Full day emotional commitment.
2027-01-04,Krakow,Morning,3h,Schindler’s Factory,No,History,In-depth WWII occupation history.
2027-01-06,Prague,Night,2h,Charles Bridge,Yes,Activity,"Less crowded, very atmospheric."
2027-01-07,Prague,Morning,6h,Terezin Day Trip,No,History,WWII Ghetto/Fortress.
2027-01-09,Vienna,Afternoon,2h,Hotel Sacher,No,Relax,Check-in and Sacher Torte.
2027-01-10,Vienna,Afternoon,2h,Flak Tower,No,History,Anti-aircraft tower (Haus des Meeres).
2027-01-11,Vienna,Morning,7h,Mauthausen Memorial,No,History,Full day trip to the quarry and camp.
